dialogue,person_scene,series,episode,episode_name_only
 I was 14 and graduating summa cum laude from college. Summa cum laude is Latin for with highest honours.,Sheldon,3.0,18.0,The Pants Alternative
 Where’s 70 children when you need ‘em?,Howard,3.0,18.0,The Pants Alternative
 Am I? Let me tell you a story.,Sheldon,3.0,18.0,The Pants Alternative
" Sheldon, you’re being ridiculous.",Leonard,3.0,18.0,The Pants Alternative
" Thank you. Yeah, I’ll bear that in mind if I’m ever nominated for the Hillbilly Peace Prize.",Sheldon,3.0,18.0,The Pants Alternative
" That’s no reason to back out. You know, I once got a pretty big honour in high school, and I was terrified about appearing in front of a big crowd, but I went through with it, and you know what? The world looked pretty darn good sitting on a haystack in the back of a Ford F-150 as a member of the Corn Queen’s court.",Penny,3.0,18.0,The Pants Alternative
 Turns out the great Sheldon Cooper has stage fright.,Howard,3.0,18.0,The Pants Alternative
 What qualifies you to attempt to understand my mind?,Sheldon,3.0,18.0,The Pants Alternative
 I thought I could try to analyze you and get to the root of your anxiety.,Leonard,3.0,18.0,The Pants Alternative
" That’s not exactly a mutation that would get you into Xavier’s School for Gifted Youngsters, but go on. Leonard?",Sheldon,3.0,18.0,The Pants Alternative
" Okay. Well, I am going to take you shopping, get you a nice suit. Might give you more confidence.",Penny,3.0,18.0,The Pants Alternative
" I don’t know. If you’re my X-Men, what are your powers?",Sheldon,3.0,18.0,The Pants Alternative
" Oh. I say a lot of things, sweetie. So, how about it, Sheldon?",Penny,3.0,18.0,The Pants Alternative
" Yeah, we watched it last week. You said you liked it.",Leonard,3.0,18.0,The Pants Alternative
 Did I see X-Men?,Penny,3.0,18.0,The Pants Alternative
 I do like the X-Men.,Sheldon,3.0,18.0,The Pants Alternative
" We can help you. We can be your team. Like, uh, Professor Xavier and his X-Men.",Leonard,3.0,18.0,The Pants Alternative
" Okay, your problem is, you’re trying to do this all by yourself.",Penny,3.0,18.0,The Pants Alternative
" Oh, I’m sorry, that is what I meant.",Sheldon,3.0,18.0,The Pants Alternative
" Yes, but you’re not smarter than all of us put together.",Penny,3.0,18.0,The Pants Alternative
" Oh, I doubt that. I haven’t figured out a way, and I’m much smarter than all of you.",Sheldon,3.0,18.0,The Pants Alternative
 We think we can help you with your stage fright.,Leonard,3.0,18.0,The Pants Alternative
 Just sit.,Penny,3.0,18.0,The Pants Alternative
 I’m not going to punch you.,Raj,3.0,18.0,The Pants Alternative
" When I was little, my sister would say to me, close your eyes, you’ll get a surprise, and then she’d punch me.",Sheldon,3.0,18.0,The Pants Alternative
 What?,Raj,3.0,18.0,The Pants Alternative
" Okay, but don’t punch me.",Sheldon,3.0,18.0,The Pants Alternative
" True, but thanks to meditation, I am able to stay in the same room with them without urinating. Now, close your eyes.",Raj,3.0,18.0,The Pants Alternative
" And yet, you can’t speak to women.",Sheldon,3.0,18.0,The Pants Alternative
" Okay, Sheldon. I’m going to be leading you through a series of meditation exercises. These methods come from the ancient gurus of India and have helped me overcome my own fears.",Raj,3.0,18.0,The Pants Alternative
 The apartment. Raj is lighting candles. Indian music is playing.,Scene,3.0,18.0,The Pants Alternative
" Oh, that’s not a good name.",Howard,3.0,18.0,The Pants Alternative
" No. The X-Men were named for the X in Charles Xavier. Since I am Sheldon Cooper, you will be my C-Men.",Sheldon,3.0,18.0,The Pants Alternative
" So, what do you say, Sheldon? Are we your X-Men?",Penny,3.0,18.0,The Pants Alternative
 And I appreciate the pretence.,Sheldon,3.0,18.0,The Pants Alternative
" My power is the ability to pretend like I give a damn about your piddly-ass problems. And that’s 24-7, buddy.",Howard,3.0,18.0,The Pants Alternative
" I see. Well, I assume, since the rest of you have set the bar so low, you’re saving the most impressive contribution for last. Go ahead, Howard. Dazzle me.",Sheldon,3.0,18.0,The Pants Alternative
" Raj says he can teach you, what did you call it? I don’t know, some Indian meditation crap.",Howard,3.0,18.0,The Pants Alternative
" My mother is a highly regarded psychiatrist, and I’ve been in therapy ever since she accused me of breast-feeding co-dependently.",Leonard,3.0,18.0,The Pants Alternative
 You own the damn thing. Just take a freaking sweater!,Raj,3.0,18.0,The Pants Alternative
" You know, the nice thing about Shel-Mart is I own it, so I get a 15% discount.",Sheldon,3.0,18.0,The Pants Alternative
" Yeah, whatever. Just go buy a sweater.",Raj,3.0,18.0,The Pants Alternative
 Suppose I could run downtown and pick up something at Shel-Mart.,Sheldon,3.0,18.0,The Pants Alternative
" Then, put on a sweater.",Raj,3.0,18.0,The Pants Alternative
 Really? This time of year? It’s a bit nippy.,Sheldon,3.0,18.0,The Pants Alternative
 Fine. You’re in Sheldon Square.,Raj,3.0,18.0,The Pants Alternative
 I thought this was supposed to be a guided meditation.,Sheldon,3.0,18.0,The Pants Alternative
 Whatever you like.,Raj,3.0,18.0,The Pants Alternative
" Where exactly? Sheldon Square? Sheldon Towers? Sheldon Stadium, home of the Fighting Sheldons?",Sheldon,3.0,18.0,The Pants Alternative
" Okay, you’re in Sheldonopolis.",Raj,3.0,18.0,The Pants Alternative
" Sim City. More specifically, the Sim City I designed, Sheldonopolis.",Sheldon,3.0,18.0,The Pants Alternative
 All right. Imagine yourself in the one place you feel most at home. Where is that?,Raj,3.0,18.0,The Pants Alternative
 I’m sorry. Proceed.,Sheldon,3.0,18.0,The Pants Alternative
 Do you want to do this or not?,Raj,3.0,18.0,The Pants Alternative
 That’s what my sister used to say.,Sheldon,3.0,18.0,The Pants Alternative
" No, you’re wrong.",Penny,3.0,18.0,The Pants Alternative
 Hmm. (Cut to Sheldon exiting changing room in a loud check suit). This is pretty sharp.,Sheldon,3.0,18.0,The Pants Alternative
 Fine. Why don’t you pick out what you like.,Penny,3.0,18.0,The Pants Alternative
 That’s a lot of money for only one colour.,Sheldon,3.0,18.0,The Pants Alternative
" Yeah, so?",Penny,3.0,18.0,The Pants Alternative
 It’s only one colour.,Sheldon,3.0,18.0,The Pants Alternative
" Yeah, that’s when I buy shoes. Now, let’s see what we’ve got. Ooh! This is nice.",Penny,3.0,18.0,The Pants Alternative
 Don’t you eventually realize you’re just the same stressed out person in a cute top or a fun skirt?,Sheldon,3.0,18.0,The Pants Alternative
" It’ll give you confidence. You know, sometimes when I’m feeling all stressed out about something, I go out and buy a cute top or a fun skirt and I have a whole new outlook on life.",Penny,3.0,18.0,The Pants Alternative
 I question your premise. How is a new suit going to prevent me from passing out in front of a ballroom full of people?,Sheldon,3.0,18.0,The Pants Alternative
 A clothing store.,Scene,3.0,18.0,The Pants Alternative
" A Godzilla-like monster is approaching the city. I have to get my people to safety. People of Sheldonopolis, this is your mayor. Follow me. If the children can’t run, leave them behind. Oh, the simulated horror! (Sound of door slamming) Raj? Just as I suspected. Meditation is nothing but hokum.",Sheldon,3.0,18.0,The Pants Alternative
 What now?,Raj,3.0,18.0,The Pants Alternative
" Hang on. It’s a cardigan. I have to button it. Oh, no.",Sheldon,3.0,18.0,The Pants Alternative
" All right. You’ve paid for a sweater, and you’re in Sheldon Square.",Raj,3.0,18.0,The Pants Alternative
" Look, I didn’t turn a profit last quarter by taking product off the shelves willy-nilly.",Sheldon,3.0,18.0,The Pants Alternative
 I was wearing size a million pants.,Sheldon,3.0,18.0,The Pants Alternative
 How did you know you were a giant if everything was to scale?,Leonard,3.0,18.0,The Pants Alternative
" I recently had a dream that I was a giant. But everything around me was to scale, so it all looked normal.",Sheldon,3.0,18.0,The Pants Alternative
" Um, I don’t know, maybe.",Leonard,3.0,18.0,The Pants Alternative
 Would it be helpful to you if I told you about my dreams?,Sheldon,3.0,18.0,The Pants Alternative
" I’m sorry, I’ll start again.",Leonard,3.0,18.0,The Pants Alternative
" That’s how you start a psychotherapy session? How am I doing? I was promised a riverboat journey into the jungles of my subconscious. Instead, I get the same question I hear from the lady who slices my bologna at Ralph’s.",Sheldon,3.0,18.0,The Pants Alternative
" So, Sheldon, how you doing?",Leonard,3.0,18.0,The Pants Alternative
 The apartment.,Scene,3.0,18.0,The Pants Alternative
 Okay. But anything I put on now is only going to suffer in comparison. (Goes into changing room. Comes out in black suit looking terrific.) This is absurd. I look like a clown.,Sheldon,3.0,18.0,The Pants Alternative
 Please just try this one on.,Penny,3.0,18.0,The Pants Alternative
 Says the former member of the Corn Queen’s Court.,Sheldon,3.0,18.0,The Pants Alternative
 It’s ridiculous.,Penny,3.0,18.0,The Pants Alternative
 In the prom department.,Sheldon,3.0,18.0,The Pants Alternative
 Where the hell d’you find that?,Penny,3.0,18.0,The Pants Alternative
" This is great. I had a suit like this when I was six. (Cut to Sheldon exiting in a white dinner suit with tails) Okay, I think we have a winner.",rhinestones),3.0,18.0,The Pants Alternative
 The award ceremony.,Scene,3.0,18.0,The Pants Alternative
" Wait, that’s it? I thought we had a whole hour!",Leonard,3.0,18.0,The Pants Alternative
" If someone as damaged as you can find his way to crawl out of bed each morning, I think I can face a simple award ceremony.",Sheldon,3.0,18.0,The Pants Alternative
 For what?,Leonard,3.0,18.0,The Pants Alternative
" Thank you, Leonard.",Sheldon,3.0,18.0,The Pants Alternative
" Damn right, I’m angry with my mother. For God’s sake, I was eight years old. She humiliated me. That’s when the bed-wetting started again.",Leonard,3.0,18.0,The Pants Alternative
" So, I hear you saying you’re angry with your mother.",Sheldon,3.0,18.0,The Pants Alternative
 It wasn’t my fault. I had never seen my brother’s project. And my mother could’ve told me before instead of at the ceremony in front of everyone.,Leonard,3.0,18.0,The Pants Alternative
 Go on.,Sheldon,3.0,18.0,The Pants Alternative
 Terrible. I worked really hard on that project. I stayed up all night singing the clown’s aria from Pagliacci to a lima bean sprout.,Leonard,3.0,18.0,The Pants Alternative
 And how did that make you feel?,Sheldon,3.0,18.0,The Pants Alternative
" But it could be part of your problem. Let me give you an example. When I was eight, I won a ribbon at the science fair for my project, “Do Lima Beans Grow Better to Classical Music.” But my mother pointed out that it was just a rehash of my brother’s earlier “Do Lima Beans Grow Worse to Rock ‘n’ Roll.” I felt so guilty, I gave the ribbon back.",Leonard,3.0,18.0,The Pants Alternative
" Really, Leonard? You’re just going to try to recycle Adler’s doctrine of the inferiority complex? I could probably get that from the woman at Ralph’s. And she’d let me taste some pieces of cheese for free.",Sheldon,3.0,18.0,The Pants Alternative
" Why don’t I just start? Sometimes people have trouble accepting accolades if, on a subconscious level, they don’t feel they deserve them. Do you think maybe that’s what’s happening here?",Leonard,3.0,18.0,The Pants Alternative
" Ah, the talking cure. Classical Freudian, good choice. If it will help speed things along, uh, my answers to the standard Rorschach ink blot test are A, a bat, B, a bat, C, a bat, and D, my father killing my mother with a hypodermic needle.",Sheldon,3.0,18.0,The Pants Alternative
 Why don’t we just talk?,Leonard,3.0,18.0,The Pants Alternative
 The apartment.,Scene,3.0,18.0,The Pants Alternative
" Thanks, shorty,I’ll take it from here. All right, you people ready to have some fun? You have a basic understanding of differential calculus and at least one year of algebraic topology? Well, then here come the jokes. Why did the chicken cross the Mobius strip? To get to the same side, bazinga! All right, a neutron walks into a bar and asks, how much for a drink? The bartender says, for you, no charge. Hello? I know you’re out there. I can hear you metabolizing oxygen and expelling carbon dioxide. Looks like we have some academic dignitaries in the audience. Dr. Randall from the geology department, only man who’s happy when they take his work for granite. Ba-da cha! I kid the geologists, of course, but it’s only ’cause I have no respect for the field. Let’s get serious for a moment. Why are we all here? ‘Cause we’re scientists. And what do scientists study? The universe. And what’s the universe made of? I am so glad you asked. (Singing) There’s antimony, arsenic, aluminium, selenium, and hydrogen and oxygen and nitrogen and rhenium, and nickel, neodymium,",Sheldon,3.0,18.0,The Pants Alternative
" Oh, right. Ladies and gentlemen, our guest of honour, Dr. Sheldon Cooper.",Leonard,3.0,18.0,The Pants Alternative
 I’m ready.,Sheldon,3.0,18.0,The Pants Alternative
" First of all, the projects were totally different. I was showing that classical music nurtures lima beans and makes them grow, but my mother didn’t hear me. If you’d like to look at the relationship between nurturing and growth, I’d like to point out that my brother is eight inches taller than me.",talking),3.0,18.0,The Pants Alternative
" Here, see if this one works.",Penny,3.0,18.0,The Pants Alternative
" I don’t feel different, this alcohol’s defective.",Sheldon,3.0,18.0,The Pants Alternative
" Fine, faint.",Penny,3.0,18.0,The Pants Alternative
 Alcohol? I don’t drink alcohol.,Sheldon,3.0,18.0,The Pants Alternative
" Here, drink this. It’ll relax you.",Penny,3.0,18.0,The Pants Alternative
 I can’t do this. I’m going to faint.,Sheldon,3.0,18.0,The Pants Alternative
 Don’t worry. You’re surrounded by your C-Men.,Raj,3.0,18.0,The Pants Alternative
 I’m getting dizzy.,Sheldon,3.0,18.0,The Pants Alternative
 What’s the matter?,Penny,3.0,18.0,The Pants Alternative
" Oh, dear.",Sheldon,3.0,18.0,The Pants Alternative
" Good evening, ladies and gentlemen. My name is Dr. Leonard Hofstadter, and it is my very great honour to introduce the winner of this year’s Chancellor’s award for Science and my good friend, Dr. Sheldon Cooper. But before I do, I’d like to share with you a letter from Sheldon’s mother, who couldn’t be here tonight. Isn’t that nice? His mother sent him a letter. She’s proud of him. I wonder what that feels like. Dear Shelly. That’s what she calls him. Shelly, it’s a pet name. You know what my mother’s pet name for me is? Leonard. But I digress. Dear Shelly. I am so proud of… (continues as background noise)",Leonard,3.0,18.0,The Pants Alternative
" Now, for the astronomers in the audience, get ready to see the dark side of the moon. And here’s Uranus.",Sheldon,3.0,18.0,The Pants Alternative
" Uh-uh, give it a minute.",Leonard,3.0,18.0,The Pants Alternative
" Oh, Lord, this couldn’t be any more humiliating.",Sheldon,3.0,18.0,The Pants Alternative
" All right, people, let’s get down to the math. It is only three dimensional thinking that limits our imagination. Can I take my pants off over my head? Of course not. My body’s in the way. But if we had access to higher dimensions, we could move our pants around our bodies through the fourth dimension and our days of dropping trousers would be over.",Sheldon,3.0,18.0,The Pants Alternative
 It’s already loaded. Just hit play.,Leonard,3.0,18.0,The Pants Alternative
 What do I search?,Sheldon,3.0,18.0,The Pants Alternative
 You might want to check YouTube.,Leonard,3.0,18.0,The Pants Alternative
" Question one, where are my pants?",Sheldon,3.0,18.0,The Pants Alternative
 Sure.,Penny,3.0,18.0,The Pants Alternative
" Penny, Leonard. Would you be able to answer some questions I’m having about the events of last night?",Sheldon,3.0,18.0,The Pants Alternative
" Sheldon, congratulations. Brought you cheesecake from work. You know, ’cause of your award, not because a busboy sneezed on it.",Penny,3.0,18.0,The Pants Alternative
 Any group big enough to trample me to death. General rule of thumb is 36 adults or 70 children.,Sheldon,3.0,18.0,The Pants Alternative
" What, to you, is a large crowd?",Leonard,3.0,18.0,The Pants Alternative
 I am perfectly comfortable speaking to small groups. I cannot speak to large crowds.,Sheldon,3.0,18.0,The Pants Alternative
" Yeah, before the movie, you did 20 minutes on why guacamole turns brown. It turned brown while you were talking.",Raj,3.0,18.0,The Pants Alternative
" Well, no, you’re mistaken. You give speeches all the time. What you can’t do is shut up.",Howard,3.0,18.0,The Pants Alternative
 They expect me to give a speech at the banquet. I can’t give a speech.,Sheldon,3.0,18.0,The Pants Alternative
 What?,Leonard,3.0,18.0,The Pants Alternative
" Hello? Oh, Chancellor Morton, how are you, sir? Yes, I was expecting your call (aside) three years ago. I see. Wait. What happens if I choose not to give a speech? Uh-huh. And if I don’t want to forfeit the award? Well, you’ve got that tied up in a neat little bow. All right. Thank you. (Hangs up) Problem.",Sheldon,3.0,18.0,The Pants Alternative
" Uh, hang on, flaming arrow.",Howard,3.0,18.0,The Pants Alternative
" Oh, that will be another congratulatory call for me. Uh, mute, please.",rings),3.0,18.0,The Pants Alternative
" Hey, you didn’t want a Slurpee at 7-Eleven, you don’t get glasses.",Leonard,3.0,18.0,The Pants Alternative
 No.,Raj,3.0,18.0,The Pants Alternative
 Didn’t it look like that spear was going to go right through your skull?,Howard,3.0,18.0,The Pants Alternative
 Am I in trouble? Did my mother call you?,Sheldon,3.0,18.0,The Pants Alternative
" Sit down, we want to talk to you.",Leonard,3.0,18.0,The Pants Alternative
 The apartment. The guys are watching Avatar in 3D. All are wearing 3D glasses except Raj.,Scene,3.0,18.0,The Pants Alternative
" Yeah, the one thing the William Shatner of theoretical physics needed was an ego boost.",Howard,3.0,18.0,The Pants Alternative
" Well, good for him.",Raj,3.0,18.0,The Pants Alternative
" I won! This is astonishing. Not that I won the award, no one deserves it more. Actually, I guess I misspoke. It’s not astonishing, more like inevitable. I’m not sure what to do first. Maybe I should call my mother. Wait! I know, I’m going to conduct an interview with myself and post it online.",Sheldon,3.0,18.0,The Pants Alternative
 You won.,Leonard,3.0,18.0,The Pants Alternative
 I won?,Sheldon,3.0,18.0,The Pants Alternative
" Oh, I’m so glad you asked it like that. You.",Leonard,3.0,18.0,The Pants Alternative
" And you want to rub my nose in the fact that my contributions are being overlooked again? I am the William Shatner of theoretical physics. All right, I’ll play. What self-important, preening fraud are they honouring this year?",Sheldon,3.0,18.0,The Pants Alternative
" Hey, Sheldon, I was up in the administration office, and I happened to overhear the name of the winner of this year’s Chancellor’s Award for Science.",Leonard,3.0,18.0,The Pants Alternative
" It amazes me how you constantly obsess over fictional details when there are more important things in the real world to worry about. For example, why wasn’t William Shatner in the new Star Trek movie?",Sheldon,3.0,18.0,The Pants Alternative
" My point is, if I were a horse or a bird, I’d be very nervous around James Cameron.",Raj,3.0,18.0,The Pants Alternative
 What’s your point?,Howard,3.0,18.0,The Pants Alternative
" So, when they ride horses and fly on the birds, they also use their ponytails.",Raj,3.0,18.0,The Pants Alternative
" Yeah, so?",Howard,3.0,18.0,The Pants Alternative
" Okay in Avatar when they have sex in Pandora they hook up their ponytails, so we know their ponytails are like their junk.",Raj,3.0,18.0,The Pants Alternative
 The university cafeteria.,Scene,3.0,18.0,The Pants Alternative
" Hey, Leonard, where do you come down on giant ants?",Howard,3.0,19.0,The Wheaton Recurrence
" Sheldon says impossible. Howard and I say not only possible, but as a mode of transportation, way cooler than a Batmobile.",Raj,3.0,19.0,The Wheaton Recurrence
 Leonard and Penny are in Penny’s bed.,Scene,3.0,19.0,The Wheaton Recurrence
 Having a little trouble catching your breath there?,Penny,3.0,19.0,The Wheaton Recurrence
" No, no, I’m good. If my P.E. teachers had told me this is what I was training for, I would have tried a lot harder.",Leonard,3.0,19.0,The Wheaton Recurrence
 Do or do not. There is no try.,Penny,3.0,19.0,The Wheaton Recurrence
" Really? Because every time we’ve talked about unusual animal genitals, you’ve always had some pretty strong and controversial opinions.",Raj,3.0,19.0,The Wheaton Recurrence
 What do you want from me? I just don’t give a rat’s ass.,Leonard,3.0,19.0,The Wheaton Recurrence
" You are ignoring the square-cube law. The giant ant would be crushed under the weight of its own exoskeleton. And for the record, the appropriate ranking of cool modes of transportation is jet pack, hoverboard, transporter, Batmobile, and then giant ant.",Sheldon,3.0,19.0,The Wheaton Recurrence
 Seriously? You have nothing better to do than sit around and discuss the possibility of giant ants?,Leonard,3.0,19.0,The Wheaton Recurrence
 What’s with him?,Howard,3.0,19.0,The Wheaton Recurrence
 Perhaps he’s at a sensitive point in his monthly cycle.,Sheldon,3.0,19.0,The Wheaton Recurrence
 Are you saying he’s man-struating?,Howard,3.0,19.0,The Wheaton Recurrence
" Not literally. But as far back as the 17th century, scientists observed a 33-day fluctuation in men’s hormone levels.",Sheldon,3.0,19.0,The Wheaton Recurrence
 Interesting. That might explain my weepy days in the middle of the month. You know what I’m talking about.,Raj,3.0,19.0,The Wheaton Recurrence
 The comic book store.,Scene,3.0,19.0,The Wheaton Recurrence
" Okay, forget giant ants. How about giant rabbits?",Howard,3.0,19.0,The Wheaton Recurrence
" Big or small, I don’t like rabbits. They always look like they’re about to say something, but they never do.",Raj,3.0,19.0,The Wheaton Recurrence
" Rabbits do have a respiratory system that would support great size. And on a side note, they are one of the few mammals whose scrotum is in front of the penis.",Sheldon,3.0,19.0,The Wheaton Recurrence
 Maybe that’s what they want to talk about.,Raj,3.0,19.0,The Wheaton Recurrence
" Leonard, where do you stand on giant rabbits and scrotal position?",Howard,3.0,19.0,The Wheaton Recurrence
 I honestly don’t care.,Leonard,3.0,19.0,The Wheaton Recurrence
" Oh, hey.",Leonard,3.0,19.0,The Wheaton Recurrence
" Good, Penny, reminder, bowling tonight at seven o’clock.",Sheldon,3.0,19.0,The Wheaton Recurrence
 Would that be a giant rat’s ass?,Howard,3.0,19.0,The Wheaton Recurrence
" For the record, giant rats are possible.",Sheldon,3.0,19.0,The Wheaton Recurrence
 Can we please talk about something else? Maybe something vaguely related to life as we know it on this planet?,Leonard,3.0,19.0,The Wheaton Recurrence
" Okay, how about this for a topic, why is Leonard being a giant douche? Assuming giant douches are possible.",Howard,3.0,19.0,The Wheaton Recurrence
 Of course they are. Leonard’s being one.,Sheldon,3.0,19.0,The Wheaton Recurrence
 Maybe he’s having a lover’s spat with Penny.,Raj,3.0,19.0,The Wheaton Recurrence
" No, there was no spat.",Leonard,3.0,19.0,The Wheaton Recurrence
" Oh, but something happened.",Howard,3.0,19.0,The Wheaton Recurrence
 I don’t want to talk about it.,Leonard,3.0,19.0,The Wheaton Recurrence
 But I sense you’re going to and I don’t want to hear about it. Excuse me.,Sheldon,3.0,19.0,The Wheaton Recurrence
" What’d you do, Romeo? You pour maple syrup all over your body and ask her if she was in the mood for a short stack?",Howard,3.0,19.0,The Wheaton Recurrence
" Did you think it would be funny to put on a pair of her panties and jump around, but it wound up just creeping her out?",Raj,3.0,19.0,The Wheaton Recurrence
 What? No.,Leonard,3.0,19.0,The Wheaton Recurrence
" I’m just asking, dude. It happens.",Raj,3.0,19.0,The Wheaton Recurrence
 These are my own bowling shoes.,Sheldon,3.0,19.0,The Wheaton Recurrence
 Then what’s with the disinfectant?,Howard,3.0,19.0,The Wheaton Recurrence
 Oh. Ouch.,Stuart,3.0,19.0,The Wheaton Recurrence
 That is what is referred to as a burn on you.,Sheldon,3.0,19.0,The Wheaton Recurrence
 Did you ask her to start waxing?,Howard,3.0,19.0,The Wheaton Recurrence
 No.,Leonard,3.0,19.0,The Wheaton Recurrence
 Did you start waxing?,Raj,3.0,19.0,The Wheaton Recurrence
 No.,Leonard,3.0,19.0,The Wheaton Recurrence
" While making love, did you accidentally spank your own ass and cry out Mommy?",Howard,3.0,19.0,The Wheaton Recurrence
 I’m walking away from you now.,Leonard,3.0,19.0,The Wheaton Recurrence
 That wasn’t a no.,Howard,3.0,19.0,The Wheaton Recurrence
" Yeah, I think we’re getting close.",Raj,3.0,19.0,The Wheaton Recurrence
 The stairwell.,Scene,3.0,19.0,The Wheaton Recurrence
 Did you take a Benadryl and fall asleep while pleasuring her? Because you can die that way.,Howard,3.0,19.0,The Wheaton Recurrence
" Oh, that would be a good way to go.",Raj,3.0,19.0,The Wheaton Recurrence
 Hi.,Penny,3.0,19.0,The Wheaton Recurrence
