dialogue,person_scene,series,episode,episode_name_only
" So, Penny doesn’t want me around her friends, I embarrass her. What else could it be?",Leonard,3.0,6.0,The Cornhusker Vortex
" Well, her actions could be out of concern for your feelings. Perhaps she’s excluded you from these gatherings because she’s scouting for a new mate and doesn’t want to do it in front of you.",Sheldon,3.0,6.0,The Cornhusker Vortex
" Oh, how kind of her.",Leonard,3.0,6.0,The Cornhusker Vortex
 Agreed. Most primates don’t show that sort of discretion. A female bonobo will copulate with a new male in front of the old one without so much as a how do you do?,Sheldon,3.0,6.0,The Cornhusker Vortex
 The apartment. Leonard and Raj are watching a football game on the television. ,Scene,3.0,6.0,The Cornhusker Vortex
" Okay, a complete pass. First down, New England. I think I’m starting to get this.",Leonard,3.0,6.0,The Cornhusker Vortex
" Really? The only thing I’ve learned in the last two hours is that American men love drinking beer, pee too often and have trouble getting erections.",Raj,3.0,6.0,The Cornhusker Vortex
" Focus on the game, not the commercials, Raj.",Leonard,3.0,6.0,The Cornhusker Vortex
" I’m just saying, maybe if you people cut back on the beer, you could get out of the bathroom and satisfy your women without pharmaceutical help.",Raj,3.0,6.0,The Cornhusker Vortex
 Hey.,Leonard,3.0,6.0,The Cornhusker Vortex
 Hi.,Penny,3.0,6.0,The Cornhusker Vortex
 How was your football party?,Leonard,3.0,6.0,The Cornhusker Vortex
 It was pretty good. We won.,Penny,3.0,6.0,The Cornhusker Vortex
" Oh, that’s excellent. It’s a weird figure of speech, isn’t it, we won when you weren’t",Leonard,3.0,6.0,The Cornhusker Vortex
 I’m glad to hear it.,Penny,3.0,6.0,The Cornhusker Vortex
" Oh, hey, on a related subject, are you embarrassed to have me around your friends?",Leonard,3.0,6.0,The Cornhusker Vortex
" Oh, my god, no. Why would you ask that?",Penny,3.0,6.0,The Cornhusker Vortex
" Well, you know, I just noticed I haven’t really met any of them.",Leonard,3.0,6.0,The Cornhusker Vortex
 Sure you have.,Penny,3.0,6.0,The Cornhusker Vortex
" Well, yeah, no, I met the huge ex-boyfriend and the smaller yet still larger than me ex-boyfriend. Were they here today?",Leonard,3.0,6.0,The Cornhusker Vortex
 Huh… Scrimmage…,Leonard,3.0,6.0,The Cornhusker Vortex
 The line of scrimmage is the imaginary transverse line separating the offence from the defence.,Sheldon,3.0,6.0,The Cornhusker Vortex
 Oh.,Leonard,3.0,6.0,The Cornhusker Vortex
 Sheldon knows football?,Howard,3.0,6.0,The Cornhusker Vortex
 Apparently.,Leonard,3.0,6.0,The Cornhusker Vortex
" Penny, I like all sorts of people. In fact, some of my best friends aren’t geniuses.",Leonard,3.0,6.0,The Cornhusker Vortex
 Like who?,Penny,3.0,6.0,The Cornhusker Vortex
" Okay, some of my Facebook friends aren’t geniuses. My point is, if we’re going to be a couple, I should be friends with your friends.",Leonard,3.0,6.0,The Cornhusker Vortex
" Okay, great. Well, then why don’t you come over next Saturday and watch the game with us.",Penny,3.0,6.0,The Cornhusker Vortex
 Another football game?,Leonard,3.0,6.0,The Cornhusker Vortex
 They have them every week.,Penny,3.0,6.0,The Cornhusker Vortex
 Did not know that.,Leonard,3.0,6.0,The Cornhusker Vortex
 You wanted to meet my friends.,Penny,3.0,6.0,The Cornhusker Vortex
" Sure, sure, just I don’t know much about football.",Leonard,3.0,6.0,The Cornhusker Vortex
" Oh, that’s okay, a lot of the guys’ girlfriends don’t know football. They just kind of drink and talk in the kitchen.",Penny,3.0,6.0,The Cornhusker Vortex
 Great.,Leonard,3.0,6.0,The Cornhusker Vortex
" Please, I’m asking you as a friend.",Leonard,3.0,6.0,The Cornhusker Vortex
 Are you making this a tier one friendship request?,Sheldon,3.0,6.0,The Cornhusker Vortex
 Yes.,Leonard,3.0,6.0,The Cornhusker Vortex
 Fine.,Sheldon,3.0,6.0,The Cornhusker Vortex
 I really appreciate this.,Leonard,3.0,6.0,The Cornhusker Vortex
" Raj, what are you doing here? You were supposed to help me pimp out my Vespa.",(arriving),3.0,6.0,The Cornhusker Vortex
" I’m sorry, are you under the impression that we’re still friends?",Raj,3.0,6.0,The Cornhusker Vortex
" Oh come on, you’re not still grinding on the kite thing, are you?",Howard,3.0,6.0,The Cornhusker Vortex
" It’s not just the kite thing. Every time we go some place, you think you can just dump me whenever someone prettier comes along, even though you don’t have a shot with them.",Raj,3.0,6.0,The Cornhusker Vortex
 But I had a shot with that jogger.,Howard,3.0,6.0,The Cornhusker Vortex
 Fine. Paint green flames on your little scooter with her. (Leaves),Raj,3.0,6.0,The Cornhusker Vortex
 It’s not a little scooter. It’s the second biggest Vespa they make! Are you watching football?,Howard,3.0,6.0,The Cornhusker Vortex
" There’s no fooling you. Now, what is this sacks statistic they put up there?",Leonard,3.0,6.0,The Cornhusker Vortex
" All I know about Saks is, my mother shops there.",Howard,3.0,6.0,The Cornhusker Vortex
" Sacks, sacks…",Leonard,3.0,6.0,The Cornhusker Vortex
 It’s football nomenclature for when a quarterback is tackled behind the line of scrimmage.,Sheldon,3.0,6.0,The Cornhusker Vortex
" Leonard, wait. Am I correct in assuming that your attempt to be accepted by Penny’s peers is based on your desire to ensure your continuing mating privileges with her?",Sheldon,3.0,6.0,The Cornhusker Vortex
" Well, I wouldn’t put it exactly that way.",Leonard,3.0,6.0,The Cornhusker Vortex
 How would you put it?,Sheldon,3.0,6.0,The Cornhusker Vortex
" Yeah, okay, like you said.",Leonard,3.0,6.0,The Cornhusker Vortex
" Huh. Seems like an awful lot of trouble to go through for intercourse. Don’t you have access to women who will do it for money? By the way, another accepted usage for the term ho.",Sheldon,3.0,6.0,The Cornhusker Vortex
" I mean, Quidditch, sure. But football?",Howard,3.0,6.0,The Cornhusker Vortex
" Sheldon, how do you know this stuff?",Leonard,3.0,6.0,The Cornhusker Vortex
" I grew up in Texas. Football is ubiquitous in Texas. Pro football, college football, high school football, peewee football, in fact, every form of football except the original, European football, which most Texans believe to be a Commie plot.",Sheldon,3.0,6.0,The Cornhusker Vortex
 Unbelievable.,Leonard,3.0,6.0,The Cornhusker Vortex
" If you’re interested, I also know all about frying meat that isn’t chicken as if it were chicken.",Sheldon,3.0,6.0,The Cornhusker Vortex
 So you could teach me?,Leonard,3.0,6.0,The Cornhusker Vortex
 Football or chicken-fried meats?,Sheldon,3.0,6.0,The Cornhusker Vortex
 Football. I’m going to Penny’s on Saturday to watch a game with her friends and I don’t want to look like an idiot. I want to blend in.,Leonard,3.0,6.0,The Cornhusker Vortex
" If you want to blend in with Penny’s friends, I’d think looking like an idiot would be the perfect camouflage.",Sheldon,3.0,6.0,The Cornhusker Vortex
" Come on, Sheldon, please teach me about football. It’ll be fun.",Leonard,3.0,6.0,The Cornhusker Vortex
" That’s exactly what my father said. Come to the games, watch the games, week in and week out from the time I was five until I went off to college. Longest seven years of my life.",Sheldon,3.0,6.0,The Cornhusker Vortex
" Wow, you just don’t get it, do you? Buying me something pretty isn’t going to make our problem just go away.",Raj,3.0,6.0,The Cornhusker Vortex
" Look, I admit I haven’t always been the best friend I could be.",Howard,3.0,6.0,The Cornhusker Vortex
" You’ve been a sucky friend, a sucky, sucky friend.",Raj,3.0,6.0,The Cornhusker Vortex
 Stipulated.,Howard,3.0,6.0,The Cornhusker Vortex
" And you do it all the time. Last week in the mall at Radio Shack, we were looking for a phone with giant numbers for your mother, and I suddenly realize you’re not even there.",Raj,3.0,6.0,The Cornhusker Vortex
" Yeah, yeah. All right, Poindexter, sit down, shut up and listen.",Sheldon,3.0,6.0,The Cornhusker Vortex
 I’m sorry?,Leonard,3.0,6.0,The Cornhusker Vortex
" That’s how my father always began our football conversations. And if you’d like, after the game, I’ll take you outside and teach you how to shoot close enough to a racoon that it craps itself.",Sheldon,3.0,6.0,The Cornhusker Vortex
 The kitchen. Sheldon is making toast in a cylon toaster which burns an image of a cylon onto the toast. ,Scene,3.0,6.0,The Cornhusker Vortex
 When are you going to stop making Cylon toast?,Leonard,3.0,6.0,The Cornhusker Vortex
 When I have enough to destroy all the human toast on the battlestar known as Galactica. Is that what you’re wearing to watch football at Penny’s?,Sheldon,3.0,6.0,The Cornhusker Vortex
 What’s wrong with a football jersey?,Leonard,3.0,6.0,The Cornhusker Vortex
" Nothing. That, however, appears to be a football cocktail dress.",Sheldon,3.0,6.0,The Cornhusker Vortex
" I’s the smallest size they had, except the one for dogs. I can’t believe they had one for dogs.",Leonard,3.0,6.0,The Cornhusker Vortex
" Oh, yes. Canine football fans are a common sight in Texas. Cats, however, refuse to wear sporting apparel. My sister found that out the hard way.",Sheldon,3.0,6.0,The Cornhusker Vortex
" Anyway, wish me luck.",Leonard,3.0,6.0,The Cornhusker Vortex
 I… I do enjoy the La Brea Tar Pits.,Raj,3.0,6.0,The Cornhusker Vortex
" Really, now? With the traffic and the parking, it’s… okay, fine. The Tar Pits. Let’s go.",Howard,3.0,6.0,The Cornhusker Vortex
" Oh, why can’t I stay mad at you?",Raj,3.0,6.0,The Cornhusker Vortex
 Penny’s apartment. Everyone is watching football.,Scene,3.0,6.0,The Cornhusker Vortex
 Go! Go! Go! Go-Go-Go-Go! Yes! Are you people watching this? Is this amazing or what?,Leonard,3.0,6.0,The Cornhusker Vortex
" Good-Bye, Sheldon.",Leonard,3.0,6.0,The Cornhusker Vortex
 Hold on I believe that social convention dictate you not arrive empty-Handed. Would you like to bring some Cylon toast?,Sheldon,3.0,6.0,The Cornhusker Vortex
" Yeah, no, I’m trying to fit in, not get laughed at.",Leonard,3.0,6.0,The Cornhusker Vortex
 What’s funny about Cylon toast?,Sheldon,3.0,6.0,The Cornhusker Vortex
 Raj’s apartment. Raj is watching a Bollywood movie. There is a knock on the door.,Scene,3.0,6.0,The Cornhusker Vortex
 It’s open.,Raj,3.0,6.0,The Cornhusker Vortex
" Hey, pal.",Howard,3.0,6.0,The Cornhusker Vortex
 What do you want?,Raj,3.0,6.0,The Cornhusker Vortex
 I brought you a little gift. New kite.,Howard,3.0,6.0,The Cornhusker Vortex
" The kite you made me lose was an authentic Patang, an Indian fighting kite that my brother sent to me from New Delhi. It took me a day to put together and two days to paint. This is Hello Kitty.",Raj,3.0,6.0,The Cornhusker Vortex
" Yeah, but it comes with a little coin purse. Does a Patang?",Howard,3.0,6.0,The Cornhusker Vortex
 I know. I just need you stop talking.,Penny,3.0,6.0,The Cornhusker Vortex
" (Knock, knock, knock) Penny. (Knock, knock, knock) Penny. (Knock, knock, knock) Penny.",Sheldon,3.0,6.0,The Cornhusker Vortex
" Sheldon, come in.",Penny,3.0,6.0,The Cornhusker Vortex
" Thank you. I’d like to make a sandwich, but I’m out of bread.",Sheldon,3.0,6.0,The Cornhusker Vortex
 There’s some in the fridge.,Penny,3.0,6.0,The Cornhusker Vortex
" I know, I know.",Howard,3.0,6.0,The Cornhusker Vortex
 And where were you?,Raj,3.0,6.0,The Cornhusker Vortex
" Getting shot down by the girl at Hot Dog on a Stick. But in my defence, she was gorgeous, and working that squeezer to make the lemonade, going up and down and up and down. It was like a free pole dance right in the middle of the food court.",Howard,3.0,6.0,The Cornhusker Vortex
 You’re impossible.,Raj,3.0,6.0,The Cornhusker Vortex
" Hey, at least I can talk to women without being drunk.",Howard,3.0,6.0,The Cornhusker Vortex
" Excuse me, I have selective mutism, a recognized medical disorder. You’re just a douche.",Raj,3.0,6.0,The Cornhusker Vortex
" No. You know what? Maybe that’s what this whole thing’s about. You’re not mad at me, you’re mad at yourself.",Howard,3.0,6.0,The Cornhusker Vortex
" No, I’m mad at you. I hate myself, but I’m mad at you.",Raj,3.0,6.0,The Cornhusker Vortex
" Fine. You’re mad at me. I get it. Now, how about we go spend the day together? Just the two of us. We’ll go anywhere you want.",Howard,3.0,6.0,The Cornhusker Vortex
 I don’t know.,Raj,3.0,6.0,The Cornhusker Vortex
 Come on. Let me take you someplace nice.,Howard,3.0,6.0,The Cornhusker Vortex
" Oh, look at that. The Oklahoma coach has thrown down a red flag indicating he’s challenging the ruling on the field. I hope he’s right, ’cause if he’s not, it’ll cost him one of his three time-Outs.",Leonard,3.0,6.0,The Cornhusker Vortex
" You know, Leonard, honey, I wouldn’t mind if you wanted to go fly kites with Sheldon.",Penny,3.0,6.0,The Cornhusker Vortex
" No, I’ll watch the end of the game. Besides, there’s only three minutes left.",Leonard,3.0,6.0,The Cornhusker Vortex
 Until half time.,Penny,3.0,6.0,The Cornhusker Vortex
 This is just half? We’ve been here for hours.,Leonard,3.0,6.0,The Cornhusker Vortex
" Sweetie, that’s a highlight from the ’98 championship game.",Penny,3.0,6.0,The Cornhusker Vortex
 Oh. Did not know that.,Leonard,3.0,6.0,The Cornhusker Vortex
 How much beer have you had?,Penny,3.0,6.0,The Cornhusker Vortex
" None, why?",Leonard,3.0,6.0,The Cornhusker Vortex
 Oh. I was just kind of hoping you were drunk. Now we’re back live.,Penny,3.0,6.0,The Cornhusker Vortex
" Okay, yeah. I can see the difference.",Leonard,3.0,6.0,The Cornhusker Vortex
" Oh, where’s the flag, that’s intentional grounding.",hat,3.0,6.0,The Cornhusker Vortex
 Totally.,guy,3.0,6.0,The Cornhusker Vortex
" That completely was a forward pass, which they threw intentionally incomplete to avoid loss of yardage or to conserve time. I can’t believe they’re not being penalized with the loss of a down and by having to move the line of scrimmage back to the spot of the foul.",Leonard,3.0,6.0,The Cornhusker Vortex
" Here, have some pizza, sweetie.",Penny,3.0,6.0,The Cornhusker Vortex
" Penny, you know I’m lactose intolerant.",Leonard,3.0,6.0,The Cornhusker Vortex
 No. This is our day.,Howard,3.0,6.0,The Cornhusker Vortex
" If you want to chase after her, chase after her.",Raj,3.0,6.0,The Cornhusker Vortex
" Ah, who am I kidding? I wouldn’t have a shot with a girl like that.",Howard,3.0,6.0,The Cornhusker Vortex
 Don’t put yourself down. You’re a very attractive man.,Raj,3.0,6.0,The Cornhusker Vortex
 You think so?,Howard,3.0,6.0,The Cornhusker Vortex
" You shouldn’t keep your bread in the refrigerator. Staleness is caused by crystallization of the starch molecules, which occurs faster at cool temperatures.",Sheldon,3.0,6.0,The Cornhusker Vortex
" On Earth, we say thank you.",Penny,3.0,6.0,The Cornhusker Vortex
" So Leonard, how goes the mimesis?",Sheldon,3.0,6.0,The Cornhusker Vortex
 Mimesis?,Leonard,3.0,6.0,The Cornhusker Vortex
 You know. Mimesis. An action in which the mimic takes on the properties of a specific object or organism. Mimesis.,Sheldon,3.0,6.0,The Cornhusker Vortex
 What the hell are you talking about?,Leonard,3.0,6.0,The Cornhusker Vortex
" I’m attempting to communicate with you without my meaning becoming apparent to those around you. Let me try again. Have the indigenous fauna accepted you as one of their own? Nudge, nudge, wink, wink.",Sheldon,3.0,6.0,The Cornhusker Vortex
" Oh, I guess so.",Leonard,3.0,6.0,The Cornhusker Vortex
" Good. Oh, FYI. After I eat my sandwich, I’m taking Koothrappali’s Patang kite out for a test run. Would you like to get your delta-wing raptor and join me?",Sheldon,3.0,6.0,The Cornhusker Vortex
" I don’t want to fly kites, Sheldon. We’re watching football here.",Leonard,3.0,6.0,The Cornhusker Vortex
 I can see that. I was providing you with an alternative. A courtesy I was never offered in similar circumstances.,Sheldon,3.0,6.0,The Cornhusker Vortex
" Actually, in this case, I think she was.",Raj,3.0,6.0,The Cornhusker Vortex
 Really?,Howard,3.0,6.0,The Cornhusker Vortex
 Yeah.,Raj,3.0,6.0,The Cornhusker Vortex
 Bye.,Howard,3.0,6.0,The Cornhusker Vortex
 What a douche.,Raj,3.0,6.0,The Cornhusker Vortex
 And you’re gonna be here for a couple more.,Penny,3.0,6.0,The Cornhusker Vortex
" Oh, you’re kidding me.",Leonard,3.0,6.0,The Cornhusker Vortex
 No.,Penny,3.0,6.0,The Cornhusker Vortex
 Nice meeting all of you.,Leonard,3.0,6.0,The Cornhusker Vortex
" So, yeah, anyway, that’s my boyfriend. He is really smart.",Penny,3.0,6.0,The Cornhusker Vortex
 The Le Brea Tar Pits.,Scene,3.0,6.0,The Cornhusker Vortex
 I really like my saber-toothed cat. Thank you.,Raj,3.0,6.0,The Cornhusker Vortex
" My pleasure. Maybe after lunch, we can go to Marie Callender’s and have some pie.",Howard,3.0,6.0,The Cornhusker Vortex
 I’d like that. This is turning out to be a perfect Saturday.,Raj,3.0,6.0,The Cornhusker Vortex
" Good. I’m glad. Oh, man. Did you see the way she smiled at me?",Howard,3.0,6.0,The Cornhusker Vortex
 Fine. Go ahead.,Raj,3.0,6.0,The Cornhusker Vortex
" Yes, she did.",Howard,3.0,6.0,The Cornhusker Vortex
" Come on, scissors, scissors!",Raj,3.0,6.0,The Cornhusker Vortex
 Hold my line.,Howard,3.0,6.0,The Cornhusker Vortex
" Wait, what are you doing? I can’t scissors by myself! Howard! Come back!",Raj,3.0,6.0,The Cornhusker Vortex
 Victory!,Sheldon,3.0,6.0,The Cornhusker Vortex
" Well, actually, the risk of throat cutting is very low. On the other hand, severe string burn is a real and ever-Present danger.",Sheldon,3.0,6.0,The Cornhusker Vortex
 You want to come watch?,Leonard,3.0,6.0,The Cornhusker Vortex
" Oh, gee, sounds amazing, but, um, I’ve got some friends coming over. Not a big thing, we’re just gonna watch the Nebraska game.",Penny,3.0,6.0,The Cornhusker Vortex
" Oh. Football, sure.",Leonard,3.0,6.0,The Cornhusker Vortex
 Good guess.,Howard,3.0,6.0,The Cornhusker Vortex
" I would’ve invited you, but I know you’re not a football fan.",Penny,3.0,6.0,The Cornhusker Vortex
" No, no, I’m not, so, great. You’ve got plans doing something you like, I’ve got plans doing something I like, so it’s good.",Leonard,3.0,6.0,The Cornhusker Vortex
" Well, maybe we’ll hang out later, you know, after everybody’s gone.",Penny,3.0,6.0,The Cornhusker Vortex
" Yeah, great.",Leonard,3.0,6.0,The Cornhusker Vortex
 See ya.,Penny,3.0,6.0,The Cornhusker Vortex
" Well, this sucks.",Leonard,3.0,6.0,The Cornhusker Vortex
" Yeah. Absolutely. It wouldn’t kill you to take a Pilates class with me now and then, but you have a certain wiry appeal.",Raj,3.0,6.0,The Cornhusker Vortex
" Yeah, well, it doesn’t matter ‘cause she wasn’t really smiling at me.",Howard,3.0,6.0,The Cornhusker Vortex
" I’m sorry, I got bored and drifted off. Where exactly in the interaction did the sucking lie?",Sheldon,3.0,6.0,The Cornhusker Vortex
" Leonard just realized that Penny’s been hiding him from her friends because he’s a tiny, little man who flies kites.",Raj,3.0,6.0,The Cornhusker Vortex
" Oh, that certainly would suck.",Sheldon,3.0,6.0,The Cornhusker Vortex
 The park.,Scene,3.0,6.0,The Cornhusker Vortex
" Wolowitz is trying to outflank us. Let out some string, add altitude and I’ll go under and cut his line.",Sheldon,3.0,6.0,The Cornhusker Vortex
 The stairwell. The guys are carrying kites.,Scene,3.0,6.0,The Cornhusker Vortex
" Kites, ho!",Leonard,3.0,6.0,The Cornhusker Vortex
 Kites ho!,Howard,3.0,6.0,The Cornhusker Vortex
 Kites ho!,Raj,3.0,6.0,The Cornhusker Vortex
" Kites, ho!",three,3.0,6.0,The Cornhusker Vortex
" Excuse me. You’re misusing the word ho. It’s an interjection used to call attention to a destination, not an object, as in, uh, Land, ho! Or, uh, Westward, ho!",Sheldon,3.0,6.0,The Cornhusker Vortex
" Kites, ho!",guys,3.0,6.0,The Cornhusker Vortex
" Hey, guys. What you doing? Going out to discover electricity?",Penny,3.0,6.0,The Cornhusker Vortex
" If you’re referring to the work of Benjamin Franklin, he did not discover electricity, he merely used a kite to determine that lightning consists of electricity. He also invented the Franklin stove, bifocals and the flexible urinary catheter. Kites, ho.",Leonard,3.0,6.0,The Cornhusker Vortex
 We’re heading out for some kite fighting.,Leonard,3.0,6.0,The Cornhusker Vortex
 Kite fighting?,Penny,3.0,6.0,The Cornhusker Vortex
" Oh, yeah. It’s an extremely competitive, cutthroat sport.",Leonard,3.0,6.0,The Cornhusker Vortex
" Well, he’s definitely not gay.",Penny,3.0,7.0,The Guitarist Amplification
" Oh, a definitely not gay musician sleeping on my girlfriend’s couch. Yippee.",Leonard,3.0,7.0,The Guitarist Amplification
" Okay, we went out a little bit, a long time ago, but we were never like going out.",Penny,3.0,7.0,The Guitarist Amplification
" Okay, not to be pedantic, but the last I checked went out was in fact the past tense of going out, which I think we all know is a popular euphemism for saw each other naked.",Leonard,3.0,7.0,The Guitarist Amplification
 I’ll just roll for you.,Sheldon,3.0,7.0,The Guitarist Amplification
 Do you have a problem with Justin staying with me?,Penny,3.0,7.0,The Guitarist Amplification
 What was your first clue?,Leonard,3.0,7.0,The Guitarist Amplification
 Uh-oh! Industrial accident.,Sheldon,3.0,7.0,The Guitarist Amplification
 You know what? Don’t talk to me like I’m an idiot.,Penny,3.0,7.0,The Guitarist Amplification
 Leonard’s car.,Scene,3.0,7.0,The Guitarist Amplification
 I don’t get how she can just announce that an old boyfriend is going to be sleeping on her couch.,Leonard,3.0,7.0,The Guitarist Amplification
" Hey, I thought of a game we can play in the car.",Sheldon,3.0,7.0,The Guitarist Amplification
" I don’t want to play a game, Sheldon.",Leonard,3.0,7.0,The Guitarist Amplification
" It’s called Scientists. Now, I will name three scientists, then you will put them in order of the size of their contribution to their respective fields. To make this game even more compelling, you must consider only the contribution of the man to the field, not the validity of the field itself. For example, Abu Musa Jabir ibn Hayn made a greater contribution to the discredited field of alchemy than Halbert Vanderplatt made to neurobiology. Okay, ready to have some fun?",Sheldon,3.0,7.0,The Guitarist Amplification
 He’s not some guy. He’s my friend.,Penny,3.0,7.0,The Guitarist Amplification
" So by friend, do you mean friend friend, gay friend, or ex boyfriend who you’re now platonic with but still might have a thing for you friend”?",Leonard,3.0,7.0,The Guitarist Amplification
 And then I say one little thing and I end up being the bad guy!,Leonard,3.0,7.0,The Guitarist Amplification
" Hint, Madame Curie had her husband to help her.",Sheldon,3.0,7.0,The Guitarist Amplification
" What am I supposed to say? Sure, Penny, I’m cool with your old boyfriend sleeping in your apartment. Well, Leonard, it doesn’t matter if you’re cool or not because I’m Penny and I’m pretty and I can do whatever the hell I want! Oh, I get it! You think you’re doing me a favour just by being in a relationship with me! No, no, Leonard! I’m doing you a favour just by being in the same room as you!",Leonard,3.0,7.0,The Guitarist Amplification
 Leonard! Stop the car!,Sheldon,3.0,7.0,The Guitarist Amplification
 What?,Leonard,3.0,7.0,The Guitarist Amplification
 I can’t listen to the two of you fight anymore.,Sheldon,3.0,7.0,The Guitarist Amplification
 Leaving the apartment.,Scene,3.0,7.0,The Guitarist Amplification
" Come on, come on, we’re late.",Sheldon,3.0,7.0,The Guitarist Amplification
" Calm down, we’ll make the movie.",Leonard,3.0,7.0,The Guitarist Amplification
" I believe my alarm is appropriate, given the situation. The movie starts in 17 minutes, which means we’ll need to make all the lights on Colorado Boulevard, plus skip the concession stand, and preshow urination.",Sheldon,3.0,7.0,The Guitarist Amplification
" Oh, dude, I wish you had said something before I pounded that last Red Bull.",Raj,3.0,7.0,The Guitarist Amplification
" Go, go, Power Rangers, go!",Sheldon,3.0,7.0,The Guitarist Amplification
 Hey.,Penny,3.0,7.0,The Guitarist Amplification
" Hey. We’re, uh, going to the movies.",Leonard,3.0,7.0,The Guitarist Amplification
" Hey, if I want to invite the entire line up of Lollapalooza to sleep in my apartment, I will, and it’s none of your business!",Penny,3.0,7.0,The Guitarist Amplification
 Are you listening to yourself? Do you know how childish you sound right now?,Leonard,3.0,7.0,The Guitarist Amplification
" Not really, no.",Penny,3.0,7.0,The Guitarist Amplification
" All right, invitation pointlessly offered, invitation declined as expected, everyone’s civil, nobody’s fighting. Have a nice evening.",Sheldon,3.0,7.0,The Guitarist Amplification
 Just give us a minute.,Leonard,3.0,7.0,The Guitarist Amplification
" Oh, take all the time you need.",Howard,3.0,7.0,The Guitarist Amplification
" So, are we going to talk about last night?",Leonard,3.0,7.0,The Guitarist Amplification
 Are you ready to apologize?,Penny,3.0,7.0,The Guitarist Amplification
 No.,Leonard,3.0,7.0,The Guitarist Amplification
" E-e-e-e-eh! Wrong answer, but thank you for playing.",Penny,3.0,7.0,The Guitarist Amplification
" Oh, come on. This is stupid.",Leonard,3.0,7.0,The Guitarist Amplification
" Oh, there it is again! You think I’m stupid!",Penny,3.0,7.0,The Guitarist Amplification
" No, there’s a difference between being stupid and acting stupid.",Leonard,3.0,7.0,The Guitarist Amplification
